Issue,Solution,Category,Keywords
Cannot connect to Wi-Fi,"1. Check if Wi-Fi is enabled on your device. 2. Forget the network and reconnect. 3. Restart your device. 4. If the problem persists, contact IT staff.",Network,wifi,internet,connection,wireless
Printer not printing,"1. Check if the printer is powered on and online. 2. Clear the print queue. 3. Restart the printer and your computer. 4. Reinstall printer drivers if needed.",Hardware,printer,print,printing,not printing
Forgot Windows password,"Contact IT staff to reset your password. Do not attempt to bypass login.",Account,password,forgot,login,windows,reset
Request graphic design or pubmat,"Describe your request in detail: purpose, content, dimensions, deadline. IT staff will handle it as Others, Repair.",Others,design,pubmat,poster,certificate,social media,publication
CCTV viewing request,"CCTV footage access is governed by the Data Privacy Act. Before IT can assist, the requesting party must: 1. Write a formal letter addressed to the Campus Director stating the exact date, time range, camera location, and reason for the request. 2. Have the Campus Director approve the letter. Once approved, IT staff will facilitate the viewing. An IT Job Request will also be filed so IT staff is informed.",External,cctv,camera,footage,recording,viewing,replay,playback,data privacy
Slow computer,"1. Restart your computer. 2. Close unused applications and browser tabs. 3. Check for malware using Windows Defender. 4. If still slow, contact IT staff for hardware assessment.",Hardware,slow,performance,lag,freeze,hanging
Blue screen / BSOD,"1. Note the error code on screen. 2. Restart your computer. 3. If recurring, contact IT staff immediately — do not ignore repeated BSODs.",Hardware,bluescreen,bsod,crash,error,blue screen
Software not opening or crashing,"1. Restart the application. 2. Restart your computer. 3. Check if the software needs an update. 4. If unresolved, contact IT for reinstallation.",Software,crash,not opening,software error,application
Request new software installation,"Describe the software needed and its purpose. IT staff will assess compatibility and install if approved.",Software,install,software,application,program,new software
No internet access,"1. Check if other devices have internet. 2. Restart your router/switch. 3. Check network cable connections. 4. Contact IT staff if all devices are affected.",Network,internet,no internet,connection,network down
